[
  {
    "id": "mum-gov_offices-01",
    "name": "Passport Seva Kendra - Lower Parel",
    "type": "gov_offices",
    "city": "mumbai",
    "lat": 18.997,
    "lng": 72.83,
    "address": "Lower Parel, Mumbai 400013",
    "gmaps_link": "https://maps.google.com/?q=18.9970,72.8300",
    "added_by": "anaydhawan"
  },
  {
    "id": "mum-gov_offices-02",
    "name": "Central Post Office - Fort",
    "type": "gov_offices",
    "city": "mumbai",
    "lat": 18.965,
    "lng": 72.8355,
    "address": "Fort, Mumbai 400001",
    "gmaps_link": "https://maps.google.com/?q=18.9650,72.8355",
    "added_by": "anaydhawan"
  },
  {
    "id": "mum-gov_offices-03",
    "name": "Mumbai GPO",
    "type": "gov_offices",
    "city": "mumbai",
    "lat": 18.9374,
    "lng": 72.8374,
    "address": "Walchand Hirachand Marg, Fort, Mumbai 400001",
    "gmaps_link": "https://maps.google.com/?q=18.9374,72.8374",
    "added_by": "yakew7"
  },
  {
    "id": "mum-gov_offices-04",
    "name": "Maharashtra Public Service Commission Office",
    "type": "gov_offices",
    "city": "mumbai",
    "lat": 18.9258,
    "lng": 72.8237,
    "address": "CGO Complex, Nariman Point, Mumbai 400021",
    "gmaps_link": "https://maps.google.com/?q=18.9258,72.8237",
    "added_by": "yakew7"
  },
  {
    "id": "mum-gov_offices-05",
    "name": "Regional Passport Office Mumbai",
    "type": "gov_offices",
    "city": "mumbai",
    "lat": 18.9374,
    "lng": 72.8348,
    "address": "Badruddin Tyabji Lane, Fort, Mumbai 400001",
    "gmaps_link": "https://maps.google.com/?q=18.9374,72.8348",
    "added_by": "yakew7"
  },
  {
    "id": "mum-gov_offices-06",
    "name": "RTO Mumbai, Tardeo",
    "type": "gov_offices",
    "city": "mumbai",
    "lat": 18.9702,
    "lng": 72.8161,
    "address": "Tardeo, Mumbai 400034",
    "gmaps_link": "https://maps.google.com/?q=18.9702,72.8161",
    "added_by": "yakew7"
  },
  {
    "id": "thn-gov_offices-01",
    "name": "Passport Seva Kendra - Thane",
    "type": "gov_offices",
    "city": "thane",
    "lat": 19.1972,
    "lng": 72.9722,
    "address": "Thane West, Thane 400601",
    "gmaps_link": "https://maps.google.com/?q=19.1972,72.9722",
    "added_by": "anaydhawan"
  },
  {
    "id": "thn-gov_offices-02",
    "name": "Thane Head Post Office",
    "type": "gov_offices",
    "city": "thane",
    "lat": 19.2183,
    "lng": 72.9781,
    "address": "Thane West, Thane 400601",
    "gmaps_link": "https://maps.google.com/?q=19.2183,72.9781",
    "added_by": "anaydhawan"
  },
  {
    "id": "thn-gov_offices-03",
    "name": "Thane District Collectorate",
    "type": "gov_offices",
    "city": "thane",
    "lat": 19.1972,
    "lng": 72.9713,
    "address": "Collector Office Road, Thane 400601",
    "gmaps_link": "https://maps.google.com/?q=19.1972,72.9713",
    "added_by": "yakew7"
  },
  {
    "id": "thn-gov_offices-04",
    "name": "RTO Thane",
    "type": "gov_offices",
    "city": "thane",
    "lat": 19.2068,
    "lng": 72.9728,
    "address": "Thane West, Thane 400601",
    "gmaps_link": "https://maps.google.com/?q=19.2068,72.9728",
    "added_by": "yakew7"
  },
  {
    "id": "thn-gov_offices-05",
    "name": "MSRTC Thane Bus Stand",
    "type": "gov_offices",
    "city": "thane",
    "lat": 19.2139,
    "lng": 72.9768,
    "address": "Thane Station Area, Thane 400601",
    "gmaps_link": "https://maps.google.com/?q=19.2139,72.9768",
    "added_by": "yakew7"
  },
  {
    "id": "nvm-gov_offices-01",
    "name": "Passport Seva Kendra, Navi Mumbai",
    "type": "gov_offices",
    "city": "navi_mumbai",
    "lat": 19.083,
    "lng": 73.028,
    "address": "Turbhe, Navi Mumbai 400705",
    "gmaps_link": "https://maps.google.com/?q=19.0830,73.0280",
    "added_by": "yakew7"
  },
  {
    "id": "nvm-gov_offices-02",
    "name": "NMMC Head Office",
    "type": "gov_offices",
    "city": "navi_mumbai",
    "lat": 19.0218,
    "lng": 73.031,
    "address": "CBD Belapur, Navi Mumbai 400614",
    "gmaps_link": "https://maps.google.com/?q=19.0218,73.0310",
    "added_by": "yakew7"
  },
  {
    "id": "nvm-gov_offices-03",
    "name": "RTO Navi Mumbai",
    "type": "gov_offices",
    "city": "navi_mumbai",
    "lat": 19.076,
    "lng": 73.013,
    "address": "Turbhe, Navi Mumbai 400705",
    "gmaps_link": "https://maps.google.com/?q=19.0760,73.0130",
    "added_by": "yakew7"
  },
  {
    "id": "blr-gov_offices-01",
    "name": "Passport Seva Kendra, Lalbagh Road",
    "type": "gov_offices",
    "city": "bangalore",
    "lat": 12.9582751,
    "lng": 77.5866433,
    "address": "45, Lalbagh Road, Shanti Nagar, Bengaluru 560027",
    "gmaps_link": "https://maps.google.com/?q=12.9582751,77.5866433",
    "added_by": "yakew7"
  },
  {
    "id": "blr-gov_offices-02",
    "name": "RTO Koramangala (Bangalore Central, KA-01)",
    "type": "gov_offices",
    "city": "bangalore",
    "lat": 12.9308439,
    "lng": 77.6226408,
    "address": "BDA Complex, 3rd Block, Koramangala, Bengaluru 560034",
    "gmaps_link": "https://maps.google.com/?q=12.9308439,77.6226408",
    "added_by": "yakew7"
  },
  {
    "id": "blr-gov_offices-03",
    "name": "Bangalore General Post Office",
    "type": "gov_offices",
    "city": "bangalore",
    "lat": 12.9810065,
    "lng": 77.5950443,
    "address": "Raj Bhavan Road, Sampangirama Nagar, Bengaluru 560001",
    "gmaps_link": "https://maps.google.com/?q=12.9810065,77.5950443",
    "added_by": "yakew7"
  },
  {
    "id": "che-gov_offices-01",
    "name": "Chennai General Post Office",
    "type": "gov_offices",
    "city": "chennai",
    "lat": 13.0930674,
    "lng": 80.2917553,
    "address": "Rajaji Salai, Parry's Corner, Chennai 600001",
    "gmaps_link": "https://maps.google.com/?q=13.0930674,80.2917553",
    "added_by": "yakew7"
  },
  {
    "id": "che-gov_offices-02",
    "name": "Passport Seva Kendra, Tambaram",
    "type": "gov_offices",
    "city": "chennai",
    "lat": 12.9297073,
    "lng": 80.1186637,
    "address": "Claret Complex, 17/19 Duraisamy Reddy Street, Tambaram, Chennai 600059",
    "gmaps_link": "https://maps.google.com/?q=12.9297073,80.1186637",
    "added_by": "yakew7"
  },
  {
    "id": "hyd-gov_offices-01",
    "name": "Hyderabad General Post Office",
    "type": "gov_offices",
    "city": "hyderabad",
    "lat": 17.3879598,
    "lng": 78.4764816,
    "address": "Abids Road, Troop Bazaar, Hyderabad 500001",
    "gmaps_link": "https://maps.google.com/?q=17.3879598,78.4764816",
    "added_by": "yakew7"
  },
  {
    "id": "hyd-gov_offices-02",
    "name": "Regional Passport Office, Hyderabad",
    "type": "gov_offices",
    "city": "hyderabad",
    "lat": 17.4392959,
    "lng": 78.4969759,
    "address": "73, Red Cross Road, Shivaji Nagar, Secunderabad 500003",
    "gmaps_link": "https://maps.google.com/?q=17.4392959,78.4969759",
    "added_by": "yakew7"
  },
  {
    "id": "kol-gov_offices-01",
    "name": "Kolkata General Post Office",
    "type": "gov_offices",
    "city": "kolkata",
    "lat": 22.5729578,
    "lng": 88.3477532,
    "address": "Netaji Subhas Road, BBD Bagh, Kolkata 700001",
    "gmaps_link": "https://maps.google.com/?q=22.5729578,88.3477532",
    "added_by": "yakew7"
  },
  {
    "id": "kol-gov_offices-02",
    "name": "RTO Kolkata (Beltala PVD, WB-01)",
    "type": "gov_offices",
    "city": "kolkata",
    "lat": 22.529757,
    "lng": 88.353685,
    "address": "38, Beltala Road, Hazra, Kolkata 700020",
    "gmaps_link": "https://maps.google.com/?q=22.529757,88.353685",
    "added_by": "yakew7"
  },
  {
    "id": "kol-gov_offices-03",
    "name": "Passport Seva Kendra, Kolkata (Brabourne Road)",
    "type": "gov_offices",
    "city": "kolkata",
    "lat": 22.5753491,
    "lng": 88.3515836,
    "address": "4 Brabourne Road, BBD Bagh, Kolkata 700001",
    "gmaps_link": "https://maps.google.com/?q=22.5753491,88.3515836",
    "added_by": "yakew7"
  },
  {
    "id": "ahm-gov_offices-01",
    "name": "Ahmedabad General Post Office",
    "type": "gov_offices",
    "city": "ahmedabad",
    "lat": 23.0281,
    "lng": 72.5902,
    "address": "Salapas Road, Behind Relief Cinema, Ahmedabad 380001",
    "gmaps_link": "https://maps.google.com/?q=23.0281,72.5902",
    "added_by": "yakew7"
  },
  {
    "id": "ahm-gov_offices-02",
    "name": "RTO Subhash Bridge, Ahmedabad (GJ-01)",
    "type": "gov_offices",
    "city": "ahmedabad",
    "lat": 23.0664532,
    "lng": 72.5838669,
    "address": "Near Subhash Bridge Circle, Shahibagh, Ahmedabad 380027",
    "gmaps_link": "https://maps.google.com/?q=23.0664532,72.5838669",
    "added_by": "yakew7"
  },
  {
    "id": "ahm-gov_offices-03",
    "name": "Passport Seva Kendra, Navrangpura",
    "type": "gov_offices",
    "city": "ahmedabad",
    "lat": 23.0297208,
    "lng": 72.5623337,
    "address": "Aarya Arcade, Netaji Subhash Chandra Road, Navrangpura, Ahmedabad 380009",
    "gmaps_link": "https://maps.google.com/?q=23.0297208,72.5623337",
    "added_by": "yakew7"
  },
  {
    "id": "delhi-ncr-gov_offices-01",
    "name": "Passport Seva Kendra, R.K. Puram",
    "type": "gov_offices",
    "city": "new_delhi",
    "lat": 28.5702618,
    "lng": 77.1878709,
    "address": "Bhikaji Cama Place area, R.K. Puram, New Delhi 110066",
    "gmaps_link": "https://maps.google.com/?q=28.5702618,77.1878709",
    "added_by": "yakew7"
  },
  {
    "id": "delhi-ncr-gov_offices-02",
    "name": "Transport Department Zonal Office, Sarai Kale Khan",
    "type": "gov_offices",
    "city": "new_delhi",
    "lat": 28.5891891,
    "lng": 77.2580654,
    "address": "Sarai Kale Khan, New Delhi 110013",
    "gmaps_link": "https://maps.google.com/?q=28.5891891,77.2580654",
    "added_by": "yakew7"
  },
  {
    "id": "jaipur-gov_offices-01",
    "name": "Passport Seva Kendra, Jaipur",
    "type": "gov_offices",
    "city": "jaipur",
    "lat": 26.8934885,
    "lng": 75.8115038,
    "address": "Bhawani Singh Road, Jaipur 302001",
    "gmaps_link": "https://maps.google.com/?q=26.8934885,75.8115038",
    "added_by": "yakew7"
  },
  {
    "id": "jaipur-gov_offices-02",